{
  "schemaVersion": 1,
  "registry": "legacy",
  "defaultLayer": "archive",
  "items": [
    {
      "id": "legacy.k-skill-ancestor",
      "name": "k-skill ancestor repository",
      "kind": "research",
      "maturity": "operational",
      "verification": "documented",
      "deployment": "not-applicable",
      "availability": "current",
      "canonicalPath": "/Users/sdh/100_Dev/120_Building/k-skill",
      "tracking": "external",
      "lastVerified": "2026-08-01",
      "sensitivity": "public",
      "relation": "Repository operating-structure ancestor"
    },
    {
      "id": "legacy.windows-android-parental-control",
      "name": "Windows and Android parental control research",
      "kind": "research",
      "maturity": "research",
      "verification": "documented",
      "deployment": "not-deployed",
      "availability": "current",
      "canonicalPath": "/Users/sdh/100_Dev/120_Building/windows_android_parental_control",
      "tracking": "external",
      "lastVerified": "2026-08-01",
      "sensitivity": "internal",
      "gap": "Schemas and research exist; no application implementation was found"
    },
    {
      "id": "legacy.k-parent-skill-hackathon",
      "name": "K-Parent hackathon prototype",
      "kind": "archive",
      "maturity": "historical",
      "verification": "documented",
      "deployment": "archived",
      "availability": "historical-evidence",
      "canonicalPath": "https://github.com/seolcoding/k-parent-skill-hackathon",
      "tracking": "git-history",
      "lastVerified": "2026-08-01",
      "sensitivity": "public",
      "relation": "Festival and family-outing web prototype"
    },
    {
      "id": "legacy.kids-safe-browser",
      "name": "Kids Safe Browser archive",
      "kind": "archive",
      "maturity": "archived",
      "verification": "documented",
      "deployment": "archived",
      "availability": "archived",
      "canonicalPath": "/Users/sdh/800_Archives/880_ColdArchive/Gdrive/externalSD/내 드라이브/Google AI Studio/Kids Safe Browser",
      "tracking": "external",
      "lastVerified": "2026-08-01",
      "sensitivity": "internal",
      "relation": "Archived React and TypeScript parental browsing prototype"
    },
    {
      "id": "legacy.forever-learn",
      "name": "Forever Learn archive",
      "kind": "archive",
      "maturity": "archived",
      "verification": "documented",
      "deployment": "archived",
      "availability": "archived",
      "canonicalPath": "/Users/sdh/800_Archives/880_ColdArchive/180_Archive/forever_learn",
      "tracking": "external",
      "lastVerified": "2026-08-01",
      "sensitivity": "internal",
      "relation": "Adult lifelong-education crawler, FastAPI, RAG, and Kakao prototype; adjacent rather than child-focused"
    },
    {
      "id": "legacy.edu-data-contest",
      "name": "Education data contest archive",
      "kind": "archive",
      "maturity": "archived",
      "verification": "documented",
      "deployment": "archived",
      "availability": "archived",
      "canonicalPath": "/Users/sdh/800_Archives/880_ColdArchive/180_Archive/edu-data-contest",
      "tracking": "external",
      "lastVerified": "2026-08-01",
      "sensitivity": "internal"
    },
    {
      "id": "legacy.busan-aidio",
      "name": "Busan AIDIO parenting-radio deliverable",
      "kind": "archive",
      "maturity": "archived",
      "verification": "documented",
      "deployment": "archived",
      "availability": "archived",
      "canonicalPath": "/Users/sdh/200_Vault/280_Archives/281_Projects/Archived_Projects/부산_AIDIO",
      "tracking": "external",
      "lastVerified": "2026-08-01",
      "sensitivity": "internal",
      "gap": "Output and pitch material were found, but no reusable implementation"
    },
    {
      "id": "legacy.k-parent-ralphthon-video",
      "name": "K-Parent Ralphthon demo video",
      "kind": "archive",
      "maturity": "archived",
      "verification": "documented",
      "deployment": "archived",
      "availability": "archived",
      "canonicalPath": "/Users/sdh/내 드라이브/k-parent-skill-ralphthon.mp4",
      "tracking": "external",
      "lastVerified": "2026-08-01",
      "sensitivity": "internal",
      "metrics": {"durationSeconds": 180}
    },
    {
      "id": "legacy.parent-master-plan",
      "name": "Parental leave and revenue master-plan pointer",
      "kind": "research",
      "maturity": "research",
      "verification": "documented",
      "deployment": "not-applicable",
      "availability": "remote-pointer",
      "canonicalPath": "/Users/sdh/내 드라이브/육아휴직 및 수익 파이프라인 구축 마스터 플랜.gdoc",
      "tracking": "external",
      "lastVerified": "2026-08-01",
      "sensitivity": "personal-pointer"
    },
    {
      "id": "legacy.skillbuilder-crawler",
      "name": "Skillbuilder crawler history",
      "kind": "archive",
      "maturity": "historical",
      "verification": "documented",
      "deployment": "archived",
      "availability": "historical-evidence",
      "canonicalPath": "skillbuilder_crawler",
      "tracking": "git-history",
      "lastVerified": "2026-08-01",
      "sensitivity": "internal",
      "relation": "Known from local manifests; no current checkout found"
    },
    {
      "id": "legacy.kosis-mcp-history",
      "name": "KOSIS MCP historical childcare artifacts",
      "kind": "archive",
      "maturity": "historical",
      "verification": "documented",
      "deployment": "archived",
      "availability": "historical-evidence",
      "canonicalPath": "kosis-mcp git history",
      "tracking": "git-history",
      "lastVerified": "2026-08-01",
      "sensitivity": "public",
      "relation": "Deleted KOSIS copies and childcare report are recoverable from Git history"
    }
  ]
}
