{
  "schemaVersion": 1,
  "registry": "apis",
  "defaultLayer": "adapter",
  "items": [
    {
      "id": "apis.neis-open-api",
      "name": "NEIS Open API",
      "kind": "api",
      "maturity": "operational",
      "verification": "live-probed",
      "deployment": "not-applicable",
      "availability": "current",
      "canonicalPath": "docs/neis_api_ref.md",
      "tracking": "git",
      "lastVerified": "2026-05-30",
      "sensitivity": "public",
      "backingPackages": ["packages.k-parent-source-neis"],
      "operations": ["school-search", "school-meal", "schedule", "classes", "timetable"]
    },
    {
      "id": "apis.schoolinfo-open-api",
      "name": "Schoolinfo Open API",
      "kind": "api",
      "maturity": "research",
      "verification": "live-probed",
      "deployment": "not-applicable",
      "availability": "current",
      "canonicalPath": "docs/schoolinfo_api_ref.md",
      "tracking": "git",
      "lastVerified": "2026-05-31",
      "sensitivity": "public",
      "gap": "Thirty-five discovered categories are not yet exposed through a reusable package"
    },
    {
      "id": "apis.childschoolinfo-open-api",
      "name": "Kindergarten Info Open API",
      "kind": "api",
      "maturity": "research",
      "verification": "live-probed",
      "deployment": "not-applicable",
      "availability": "current",
      "canonicalPath": "docs/childschoolinfo_api_ref.md",
      "tracking": "git",
      "lastVerified": "2026-05-31",
      "sensitivity": "public",
      "gap": "The live endpoint family is documented but not yet integrated as a reusable package"
    },
    {
      "id": "apis.data-go-kr-parent-catalog",
      "name": "data.go.kr K-Parent catalog",
      "kind": "api",
      "maturity": "research",
      "verification": "live-probed",
      "deployment": "not-applicable",
      "availability": "current",
      "canonicalPath": "docs/data_portal_api_list.md",
      "tracking": "git",
      "lastVerified": "2026-05-31",
      "sensitivity": "public",
      "gap": "Catalog discovery does not imply access approval or production readiness"
    },
    {
      "id": "apis.tourapi",
      "name": "Korea Tourism TourAPI",
      "kind": "api",
      "maturity": "implemented",
      "verification": "fixture-tested",
      "deployment": "not-applicable",
      "availability": "current",
      "canonicalPath": "packages/k-parent-source-tourapi",
      "tracking": "git",
      "lastVerified": "2026-08-01",
      "sensitivity": "public",
      "backingPackages": ["packages.k-parent-source-tourapi"]
    },
    {
      "id": "apis.seoul-public-service",
      "name": "Seoul Public Service Reservation API",
      "kind": "api",
      "maturity": "implemented",
      "verification": "fixture-tested",
      "deployment": "not-applicable",
      "availability": "current",
      "canonicalPath": "packages/k-parent-source-seoul",
      "tracking": "git",
      "lastVerified": "2026-08-01",
      "sensitivity": "public",
      "backingPackages": ["packages.k-parent-source-seoul"]
    },
    {
      "id": "apis.data4library",
      "name": "Data4Library API",
      "kind": "api",
      "maturity": "implemented",
      "verification": "fixture-tested",
      "deployment": "not-applicable",
      "availability": "current",
      "canonicalPath": "packages/k-parent-source-library",
      "tracking": "git",
      "lastVerified": "2026-08-01",
      "sensitivity": "public",
      "backingPackages": ["packages.k-parent-source-library"]
    },
    {
      "id": "apis.culture-portal",
      "name": "Culture Portal API",
      "kind": "api",
      "maturity": "implemented",
      "verification": "fixture-tested",
      "deployment": "not-applicable",
      "availability": "current",
      "canonicalPath": "packages/k-parent-source-culture",
      "tracking": "git",
      "lastVerified": "2026-08-01",
      "sensitivity": "public",
      "backingPackages": ["packages.k-parent-source-culture"]
    },
    {
      "id": "apis.naver-search",
      "name": "Naver Search APIs",
      "kind": "api",
      "maturity": "implemented",
      "verification": "fixture-tested",
      "deployment": "not-applicable",
      "availability": "current",
      "canonicalPath": "packages/k-parent-source-naver",
      "tracking": "git",
      "lastVerified": "2026-08-01",
      "sensitivity": "public",
      "backingPackages": ["packages.k-parent-source-naver"]
    },
    {
      "id": "apis.coupang-partners",
      "name": "Coupang Partners API",
      "kind": "api",
      "maturity": "implemented",
      "verification": "fixture-tested",
      "deployment": "not-applicable",
      "availability": "current",
      "canonicalPath": "packages/k-parent-source-coupang",
      "tracking": "git",
      "lastVerified": "2026-08-01",
      "sensitivity": "public",
      "backingPackages": ["packages.k-parent-source-coupang"]
    },
    {
      "id": "apis.youtube-data",
      "name": "YouTube Data API",
      "kind": "api",
      "maturity": "implemented",
      "verification": "fixture-tested",
      "deployment": "not-applicable",
      "availability": "current",
      "canonicalPath": "packages/k-parent-source-youtube",
      "tracking": "git",
      "lastVerified": "2026-08-01",
      "sensitivity": "public",
      "backingPackages": ["packages.k-parent-source-youtube"],
      "gap": "Strict SafeSearch is implemented; age suitability and ads/shorts filtering are not"
    },
    {
      "id": "apis.k-skill-proxy-neis",
      "name": "k-skill proxy NEIS surface",
      "kind": "api",
      "maturity": "implemented",
      "verification": "offline-tested",
      "deployment": "deployment-unverified",
      "availability": "current",
      "canonicalPath": "packages/k-skill-proxy/src/server.js",
      "tracking": "git",
      "lastVerified": "2026-08-01",
      "sensitivity": "public",
      "operations": [
        "/v1/neis/school-search",
        "/v1/neis/school-meal",
        "/v1/neis/timetable",
        "/v1/neis/classes",
        "/v1/neis/schedule"
      ],
      "gap": "Current feature-branch routes have not been canary-verified in production"
    }
  ]
}
