{
  "schemaVersion": 1,
  "registry": "crawlers",
  "defaultLayer": "tool",
  "items": [
    {
      "id": "crawlers.neis-homepage-notices",
      "name": "Nationwide school homepage notice probe",
      "kind": "crawler",
      "maturity": "operational",
      "verification": "live-probed",
      "deployment": "local-only",
      "availability": "current",
      "canonicalPath": "scripts/neis_homepage_notice_probe.py",
      "tracking": "git",
      "lastVerified": "2026-05-31",
      "sensitivity": "public",
      "datasets": ["datasets.neis-notices-final-raw", "datasets.neis-notices-report"]
    },
    {
      "id": "crawlers.neis-playwright-recovery",
      "name": "NEIS notice Playwright recovery",
      "kind": "crawler",
      "maturity": "implemented",
      "verification": "live-probed",
      "deployment": "local-only",
      "availability": "current",
      "canonicalPath": "scripts/neis_playwright_recover_notices.py",
      "tracking": "git",
      "lastVerified": "2026-05-31",
      "sensitivity": "public",
      "datasets": ["datasets.neis-notices-final-raw"]
    },
    {
      "id": "crawlers.neis-parent-scenarios",
      "name": "Synthetic NEIS parent scenario probe",
      "kind": "crawler",
      "maturity": "implemented",
      "verification": "live-probed",
      "deployment": "local-only",
      "availability": "current",
      "canonicalPath": "scripts/neis_parent_scenario_probe.py",
      "tracking": "git",
      "lastVerified": "2026-05-31",
      "sensitivity": "synthetic",
      "datasets": ["datasets.neis-parent-scenarios-raw", "datasets.neis-parent-scenarios-report"]
    },
    {
      "id": "crawlers.neis-live-probe",
      "name": "NEIS live API probe",
      "kind": "crawler",
      "maturity": "implemented",
      "verification": "live-probed",
      "deployment": "local-only",
      "availability": "current",
      "canonicalPath": "scripts/neis_live_probe.py",
      "tracking": "git",
      "lastVerified": "2026-05-30",
      "sensitivity": "public",
      "apis": ["apis.neis-open-api"]
    },
    {
      "id": "crawlers.schoolinfo-live-probe",
      "name": "Schoolinfo live API probe",
      "kind": "crawler",
      "maturity": "research",
      "verification": "live-probed",
      "deployment": "local-only",
      "availability": "current",
      "canonicalPath": "scripts/schoolinfo_live_probe.py",
      "tracking": "git",
      "lastVerified": "2026-05-31",
      "sensitivity": "public",
      "apis": ["apis.schoolinfo-open-api"]
    },
    {
      "id": "crawlers.childschoolinfo-live-probe",
      "name": "Kindergarten Info live API probe",
      "kind": "crawler",
      "maturity": "research",
      "verification": "live-probed",
      "deployment": "local-only",
      "availability": "current",
      "canonicalPath": "scripts/childschoolinfo_live_probe.py",
      "tracking": "git",
      "lastVerified": "2026-05-31",
      "sensitivity": "public",
      "apis": ["apis.childschoolinfo-open-api"]
    },
    {
      "id": "crawlers.data-portal-audit",
      "name": "data.go.kr K-Parent catalog audit",
      "kind": "crawler",
      "maturity": "implemented",
      "verification": "live-probed",
      "deployment": "local-only",
      "availability": "current",
      "canonicalPath": "scripts/data_portal_k_parent_audit.mjs",
      "tracking": "git",
      "lastVerified": "2026-05-31",
      "sensitivity": "public",
      "apis": ["apis.data-go-kr-parent-catalog"],
      "datasets": ["datasets.data-portal-candidates"]
    },
    {
      "id": "crawlers.data-portal-queue",
      "name": "data.go.kr K-Parent apply queue builder",
      "kind": "crawler",
      "maturity": "implemented",
      "verification": "offline-tested",
      "deployment": "local-only",
      "availability": "current",
      "canonicalPath": "scripts/data_portal_k_parent_queue.mjs",
      "tracking": "git",
      "lastVerified": "2026-05-31",
      "sensitivity": "public",
      "datasets": ["datasets.data-portal-candidates", "datasets.data-portal-queue"]
    },
    {
      "id": "crawlers.data-portal-spec-matrix",
      "name": "data.go.kr K-Parent spec matrix builder",
      "kind": "crawler",
      "maturity": "implemented",
      "verification": "offline-tested",
      "deployment": "local-only",
      "availability": "current",
      "canonicalPath": "scripts/data_portal_k_parent_spec_matrix.mjs",
      "tracking": "git",
      "lastVerified": "2026-05-31",
      "sensitivity": "public",
      "datasets": ["datasets.data-portal-api-specs", "datasets.data-portal-targets"]
    },
    {
      "id": "crawlers.data-portal-headless-apply",
      "name": "data.go.kr headless apply prototype",
      "kind": "crawler",
      "maturity": "prototype",
      "verification": "documented",
      "deployment": "not-deployed",
      "availability": "current",
      "canonicalPath": "scripts/data_portal_apply_headless.mjs",
      "tracking": "git",
      "lastVerified": "2026-05-31",
      "sensitivity": "internal",
      "gap": "Application submission remains an explicit user-approved action and was not automated as an operational service"
    }
  ]
}
