{
  "schemaVersion": 1,
  "registry": "datasets",
  "defaultLayer": "data",
  "items": [
    {
      "id": "datasets.neis-notices-final-raw",
      "name": "Nationwide school notice crawl final raw output",
      "kind": "dataset",
      "maturity": "operational",
      "verification": "live-probed",
      "deployment": "not-applicable",
      "availability": "current",
      "canonicalPath": "tmp/neis_homepage_notice_all_schools_probe.json",
      "tracking": "ignored",
      "lastVerified": "2026-05-31",
      "sensitivity": "public",
      "metrics": {
        "targetSchools": 12521,
        "parsedSchools": 12247,
        "notices": 101110,
        "fetchErrors": 197,
        "noNoticeSchools": 60,
        "foundButUnparsed": 17,
        "playwrightRecoveries": 581,
        "bytes": 73286499
      },
      "report": "datasets.neis-notices-report"
    },
    {
      "id": "datasets.neis-notices-first-pass",
      "name": "Nationwide school notice crawl first pass",
      "kind": "dataset",
      "maturity": "historical",
      "verification": "live-probed",
      "deployment": "not-applicable",
      "availability": "current",
      "canonicalPath": "tmp/neis_homepage_notice_all_schools_probe.first_pass_12519.json",
      "tracking": "ignored",
      "lastVerified": "2026-05-31",
      "sensitivity": "public",
      "metrics": {"targetSchools": 12519, "notices": 75466, "bytes": 57417497}
    },
    {
      "id": "datasets.neis-notices-report",
      "name": "Nationwide school notice crawl archived generated report",
      "kind": "dataset",
      "maturity": "implemented",
      "verification": "documented",
      "deployment": "not-applicable",
      "availability": "remote-pointer",
      "canonicalPath": "https://github.com/seolcoding/k-parent-skill/blob/28462cdc547eccd13dafc0e3d526202c64ead1a0/docs/neis_homepage_notice_all_schools_probe.md",
      "tracking": "external",
      "lastVerified": "2026-05-31",
      "sensitivity": "public"
    },
    {
      "id": "datasets.neis-parent-scenarios-raw",
      "name": "Synthetic NEIS parent scenario raw output",
      "kind": "dataset",
      "maturity": "implemented",
      "verification": "live-probed",
      "deployment": "not-applicable",
      "availability": "current",
      "canonicalPath": "tmp/neis_parent_scenario_report.json",
      "tracking": "ignored",
      "lastVerified": "2026-05-31",
      "sensitivity": "synthetic",
      "metrics": {"scenarios": 300, "passed": 300, "bytes": 374147},
      "gap": "These are synthetic API scenarios, not a corpus of private parent-child conversations"
    },
    {
      "id": "datasets.neis-parent-scenarios-report",
      "name": "Synthetic NEIS parent scenario archived generated report",
      "kind": "dataset",
      "maturity": "implemented",
      "verification": "documented",
      "deployment": "not-applicable",
      "availability": "remote-pointer",
      "canonicalPath": "https://github.com/seolcoding/k-parent-skill/blob/28462cdc547eccd13dafc0e3d526202c64ead1a0/docs/neis_parent_scenario_report.md",
      "tracking": "external",
      "lastVerified": "2026-05-31",
      "sensitivity": "synthetic"
    },
    {
      "id": "datasets.data-portal-candidates",
      "name": "data.go.kr K-Parent candidate catalog",
      "kind": "dataset",
      "maturity": "research",
      "verification": "live-probed",
      "deployment": "not-applicable",
      "availability": "current",
      "canonicalPath": "tmp/data_portal_k_parent_candidates.json",
      "tracking": "ignored",
      "lastVerified": "2026-05-31",
      "sensitivity": "public",
      "metrics": {"catalogListings": 95805, "candidateListings": 44541, "bytes": 257243}
    },
    {
      "id": "datasets.data-portal-queue",
      "name": "data.go.kr K-Parent apply review queue",
      "kind": "dataset",
      "maturity": "research",
      "verification": "offline-tested",
      "deployment": "not-applicable",
      "availability": "current",
      "canonicalPath": "tmp/data_portal_k_parent_apply_queue.json",
      "tracking": "ignored",
      "lastVerified": "2026-05-31",
      "sensitivity": "internal",
      "metrics": {"queueItems": 324, "bytes": 405214}
    },
    {
      "id": "datasets.data-portal-api-specs",
      "name": "data.go.kr K-Parent API spec matrix",
      "kind": "dataset",
      "maturity": "research",
      "verification": "offline-tested",
      "deployment": "not-applicable",
      "availability": "current",
      "canonicalPath": "tmp/data_portal_k_parent_api_specs.json",
      "tracking": "ignored",
      "lastVerified": "2026-05-31",
      "sensitivity": "public",
      "metrics": {"specs": 82, "verifyWrap": 59, "reviewApply": 23, "bytes": 157930}
    },
    {
      "id": "datasets.data-portal-targets",
      "name": "data.go.kr K-Parent integration targets",
      "kind": "dataset",
      "maturity": "research",
      "verification": "offline-tested",
      "deployment": "not-applicable",
      "availability": "current",
      "canonicalPath": "tmp/data_portal_k_parent_targets.json",
      "tracking": "ignored",
      "lastVerified": "2026-05-31",
      "sensitivity": "public",
      "metrics": {"targets": 15, "bytes": 21599}
    },
    {
      "id": "datasets.curriculum-achievement-standards",
      "name": "Elementary curriculum achievement standards",
      "kind": "dataset",
      "maturity": "implemented",
      "verification": "offline-tested",
      "deployment": "not-applicable",
      "availability": "current",
      "canonicalPath": "packages/k-parent-quiz-core/data/achievement-standards-elementary.json",
      "tracking": "git",
      "lastVerified": "2026-08-01",
      "sensitivity": "public",
      "metrics": {"standards": 399}
    },
    {
      "id": "datasets.quiz-bank",
      "name": "Deterministic elementary quiz bank",
      "kind": "dataset",
      "maturity": "implemented",
      "verification": "offline-tested",
      "deployment": "not-applicable",
      "availability": "current",
      "canonicalPath": "apps/k-parent-quiz-app/assets/data/quiz_bank.json",
      "tracking": "git",
      "lastVerified": "2026-08-01",
      "sensitivity": "synthetic",
      "metrics": {"questions": 2668}
    },
    {
      "id": "datasets.kosis-child-safety-mortality",
      "name": "KOSIS child safety accident mortality by region",
      "kind": "dataset",
      "maturity": "research",
      "verification": "documented",
      "deployment": "not-applicable",
      "availability": "current",
      "canonicalPath": "/Users/sdh/100_Dev/120_Building/remotion-bar-race-chart/public/rawData/DT_1YL10005_아동_십만명당_안전사고사망률(시도).json",
      "tracking": "external",
      "lastVerified": "2026-08-01",
      "sensitivity": "public",
      "metrics": {"rows": 1201, "bytes": 396659}
    },
    {
      "id": "datasets.kosis-parent-living-expenses",
      "name": "KOSIS parent living-expense financing by region",
      "kind": "dataset",
      "maturity": "research",
      "verification": "documented",
      "deployment": "not-applicable",
      "availability": "current",
      "canonicalPath": "/Users/sdh/100_Dev/120_Building/remotion-bar-race-chart/public/rawData/INH_1SSFA021R_부모_생활비_마련_방법(시도).json",
      "tracking": "external",
      "lastVerified": "2026-08-01",
      "sensitivity": "public",
      "metrics": {"rows": 1142, "bytes": 350989}
    }
  ]
}
